{
  "type": "https://fasti.scrobble.dev/v1/problems/capability-unavailable",
  "title": "Capability unavailable",
  "status": 501,
  "detail": "requested capability is not available in this body; it is owned by b2",
  "code": "capability_unavailable",
  "capability_id": "credential.revoke",
  "safe_state": "no_mutation",
  "retryability": "not_retryable",
  "next_actions": [
    {
      "id": "review_capability_status",
      "label": "Review the local capability registry"
    }
  ],
  "correlation_id": "req_018f0e0e7f7b7000800000000000001e",
  "param": null,
  "actual": null,
  "violations": []
}
