{
  "type": "https://fasti.scrobble.dev/v1/problems/metadata-claim-stale",
  "title": "Metadata claim stale",
  "status": 409,
  "detail": "the provider refresh did not produce a fresh claim; the last-known-good claim remains active",
  "code": "metadata_claim_stale",
  "capability_id": "metadata.claim.refresh",
  "safe_state": "prior_state_retained",
  "retryability": "retry_safe",
  "next_actions": [
    {
      "id": "retry_metadata_refresh",
      "label": "Retry the metadata refresh or use the labelled last-known-good value"
    }
  ],
  "correlation_id": "req_018f0e0e7f7b70008000000000000036",
  "param": null,
  "actual": null,
  "violations": []
}
