{
  "type": "https://fasti.scrobble.dev/v1/problems/provider-credential-missing",
  "title": "Provider credential missing",
  "status": 409,
  "detail": "this provider capability requires a stored credential",
  "code": "provider_credential_missing",
  "capability_id": "provider.credential.test",
  "safe_state": "prior_state_retained",
  "retryability": "retry_after_correction",
  "next_actions": [
    {
      "id": "configure_provider_credential",
      "label": "Configure the required provider credential"
    }
  ],
  "correlation_id": "req_018f0e0e7f7b70008000000000000033",
  "param": null,
  "actual": null,
  "violations": []
}
